<!ELEMENT libros (libro+)>
<!ELEMENT libro (titulo, autor, genero, anioPublicacion, editorial)>
<!ATTLIST libro
    ISBN CDATA #REQUIRED
    tipo CDATA #REQUIRED
>

<!ELEMENT titulo (#PCDATA)>
<!ELEMENT autor (nombre, fechaNacimiento)>
<!ATTLIST autor
    nacidoEnEspaÃ±a (SI | NO) #REQUIRED
>
<!ELEMENT nombre (#PCDATA)>
<!ELEMENT fechaNacimiento (#PCDATA)>
<!ELEMENT genero (#PCDATA)>
<!ELEMENT anioPublicacion (#PCDATA)>
<!ELEMENT editorial (#PCDATA)>
